0,1,2,3
business insider,jennifer sor,"distressed commercial real estate debt hit $80 billion last quarter, the highest amount in a decade",2023-10-19T15:09:14Z
grit daily,NA,ranka vucetic on 3 common real estate problems solved by bespoke service,2023-10-31T11:00:08Z
business insider,phil rosen,china's country garden reportedly misses final deadline for a $154 million bond payment,2023-10-18T16:25:20Z
business insider,theron mohamed,"wall street warning: ray dalio, jamie dimon, larry fink issue grim outlooks for the global economy",2023-10-25T12:55:06Z
business insider,jennifer ortakales dawkins,tjmaxx is quietly closing stores in new york and chicago here are the confirmed locations,2023-11-02T18:54:22Z
business insider,katherine tangalakis-lippert,who's funding hamas?,2023-10-22T00:32:03Z
npr,jennifer ludden,"to tackle homelessness faster, la has a kind of real estate agency for the unhoused",2023-10-24T13:45:55Z
business insider,haley tenore,"home prices are dropping fast in phoenix here are 6 of the lowest-priced real estate listings there right now — including one at $215,000",2023-10-15T08:52:01Z
business insider,kelsey neubauer,the allure of tennessee: why floridians are trading their sandy beaches for a quieter life,2023-10-31T21:52:25Z
lifehackercom,daniel oropeza,evil week: everything you can find out about someone from public information,2023-11-01T17:54:00Z
npr,alana wise,'breakfast club' host dj envy is being sued for alleged investment fraud,2023-10-28T12:01:08Z
business insider,hana r alberts,a new 'wake-up call for real-estate agents' could reshape how we buy and sell homes,2023-11-01T19:25:37Z
business insider,james rodriguez,"real-estate agents may be forced to charge home buyers less, thanks to a new $18 billion verdict",2023-11-05T11:22:01Z
grit daily,NA,how techvestor uses data to excel in the short-term rental market,2023-10-24T11:00:31Z
time,oliver staley,the housing market is so bad that zillow is offering buyers free money,2023-10-18T15:47:00Z
business insider,huileng tan,jeff bezos just added yet another property to his 'billionaire bunker' collection after snapping up a 7-bedroom mansion for $79 million: report,2023-10-13T04:36:07Z
business insider,huileng tan,"bad news, homeowners: 1 of these 3 things needs to happen for house prices to be considered affordable, says a real estate expert",2023-10-10T04:06:04Z
business insider,"tanza loudenback,lisa niser, ea","inheritance tax: what it is, who has to pay, and how to avoid it",2023-10-23T19:08:48Z
business insider,sawdah bhaimiya,"google and property developer lendlease ended a deal on $15 billion of bay area real estate projects, as big tech continues to review the role of offices",2023-11-03T11:58:26Z
forbes,NA,5 startup opportunities in real estate,2023-10-27T13:17:21Z
business insider,tom carter,wework's inevitable retreat is here,2023-11-02T12:51:18Z
wired,christopher null,"hp spectre foldable review: a $5,000 laptop",2023-10-29T11:00:00Z
boing boing,rob beschizza,"ftx executives blew $8bn on real estate deals, donations to politicians, random ""endorsements"" and various other stupid things",2023-10-19T23:41:44Z
slashdotorg,editordavid,dropbox returns over 25% of its san francisco hq to its landlord,2023-10-22T11:34:00Z
business insider,kneubauer@insidercom (kelsey neubauer),floridians are looking to move to these 7 states,2023-10-17T09:30:01Z
business insider,kylie kirschner,home prices are dropping in las vegas here are 5 of the cheapest homes for sale right now — all under $300k,2023-10-26T15:17:37Z
business insider,pete syme,a condo on new york's billionaires' row sells for less than half of its original $135 million asking price,2023-10-25T14:31:51Z
business insider,lloyd lee,the average monthly mortgage on a new home is 52% higher than the average rent on an apartment: report,2023-10-23T05:37:28Z
business insider,phil rosen,"china's property sector is facing massive risks and authorities must meet it with 'forceful action', imf says",2023-10-10T12:59:54Z
readwrite,radek zielinski,google backs out of $15b bay area campus deals,2023-11-04T13:00:31Z
cool hunting,david graver,interview: master distiller viridiana tinoco on clase azuls latest flavorful expression,2023-11-01T17:24:05Z
bloggercom,calculated risk,"real estate newsletter articles this week: new home sales increase to 759,000 annual rate in september",2023-10-28T18:11:00Z
boing boing,jennifer sandlin,sisters win workplace halloween costume award for this amazing roller coaster costume,2023-11-02T13:12:05Z
boing boing,jason weisberger,trump idolizes al capone in lament over multiple indictments,2023-10-10T15:42:48Z
business insider,laura italiano,"allen weisselberg, trump's loyal ex-cfo, calls tripling the size of trump's penthouse in financial records a 'minor' mistake",2023-10-10T16:44:46Z
bloggercom,calculated risk,real estate newsletter articles this week: current state of the housing market,2023-10-14T18:11:00Z
small business trends,michael guta,5 real estate email templates,2023-10-10T08:21:20Z
bloggercom,calculated risk,"real estate newsletter articles this week: outstanding mortgage rates, ltv and credit scores",2023-10-07T18:11:00Z
bloggercom,calculated risk,real estate newsletter articles this week: existing-home sales decreased to new cycle low,2023-10-21T18:11:00Z
boing boing,david pescovitz,"for $15 million, you could own this large san francisco bay area home featuring six bedroom, four baths, and a meth lab!",2023-10-30T21:27:49Z
business insider,phil rosen,investors warn evergrande could face an 'uncontrolled collapse' that would be a disaster for china's property sector,2023-10-09T16:32:15Z
business insider,claire turrell,"i converted a sheep barn into an airbnb with $2,000 now, i manage over 100 listings here's how i grew my business and weathered the airbnb apocalypse",2023-10-19T09:13:27Z
business insider,aria yang,i quit my $370k job at meta after having panic attacks and hitting the lowest point of my life i just knew the job wasn't right for me,2023-10-09T09:07:01Z
business insider,cork gaines,uk household wealth has tanked and it's a sign of what could happen in the us,2023-11-01T10:05:02Z
business insider,insider@insidercom (eliza relman),home sweet times square: how new york city can save midtown manhattan from the 'urban doom loop',2023-10-08T09:57:01Z
business insider,"daniel geiger,ellen thomas,alistair barr","data centers are sprouting up as a result of the ai boom, minting fortunes, sucking up energy, and changing rural america",2023-10-13T16:15:37Z
business insider,filip de mott,"ether could jump 400% in a few years before staging a longer-term rally to $35,000, standard chartered says",2023-10-11T15:45:12Z
business insider,theron mohamed,"elon musk warned of cybertruck headaches, consumers' debt woes, and a 'stormy' economic backdrop on tesla's earnings call here are his 14 best quotes",2023-10-19T11:36:55Z
business insider,huileng tan,jeff bezos is moving to miami after 29 years in seattle,2023-11-03T01:34:19Z
bloggercom,calculated risk,real estate newsletter articles this week: national house price index up 26% year-over-year in august,2023-11-04T18:11:00Z
bbc news,https://wwwfacebookcom/bbcnews,judge threatens to jail trump for 'blatant' gag order violation,2023-10-20T16:53:13Z
business insider,jacob zinkula,"3 reasons it could be the right time to buy a home, despite high interest rates",2023-10-22T10:18:01Z
business insider,tom carter,"dropbox plans to pay $79 million to shrink its huge sf office, after ceo says the rto push will fail",2023-10-23T11:39:17Z
business insider,theron mohamed,'rich dad poor dad' author echoes warren buffett's signature warning against trying to time the market,2023-10-23T11:08:59Z
business insider,john l dorman,"trump mixed up square miles and acres when he bragged to romney about returning land to utah, book says",2023-10-25T16:11:25Z
business insider,kelsey neubauer,locals are being priced out of texas and florida here's where they're looking for affordable homes instead,2023-10-15T09:07:01Z
business insider,llopez@insidercom (linette lopez),the great china boom is going bust,2023-10-15T10:22:02Z
ritholtzcom,barry ritholtz,bubble risk in city property markets?,2023-10-30T13:00:35Z
business insider,theron mohamed,jpmorgan's dimon warns the fed's inflation war will spook markets - and flags a raft of threats to the us economy,2023-11-02T11:08:06Z
business insider,jzitser@businessinsidercom (joshua zitser),i advise lottery winners it's easy to make bad decisions – here's what i tell people so they don't blow all their money,2023-10-07T08:30:46Z
business insider,theron mohamed,"be ready for the s&p 500 to crash by 50%, house prices to slide, and a recession to strike, jeremy grantham says here are the elite investor's 16 best quotes from a new interview",2023-10-07T10:35:01Z
business insider,theron mohamed,"the fed's own economists are predicting a goldilocks scenario: no recession, falling inflation, and flat unemployment",2023-10-12T14:01:38Z
business insider,filip de mott,"capital is leaving china at the fastest pace in more than 7 years, sending the yuan lower",2023-10-23T14:24:41Z
npr,greg allen,feeling the pinch of high home insurance rates? it's not getting better anytime soon,2023-10-26T09:01:17Z
uncratecom,uncrate,sony ps5 slim console,2023-10-10T19:00:00Z
business insider,adam rogers,dont blame the pandemic for all the empty storefronts on your street blame big banks,2023-10-31T09:55:01Z
business insider,jacob shamsian,trump waited until after he left office to disclose trademarks he owns in china and russia,2023-11-03T16:38:50Z
pitchfork,"evan minsker, matthew strauss",kevin abstract announces first solo album since brockhamptons indefinite hiatus,2023-10-11T16:07:44Z
forbes,NA,"modern estate planning that prioritizes people, communities, and the planet",2023-10-10T13:15:00Z
bloggercom,calculated risk,"fed sloos survey: banks reported tighter standards, weaker demand for all loan types",2023-11-06T19:00:00Z
macrumors,juli clover,have a 13-inch macbook pro? here's why you should upgrade to the new m3 14-inch model,2023-11-01T19:06:51Z
business insider,mberg@insidercom (madeline berg),there's one thing taylor swift isn't talking about,2023-11-01T09:24:01Z
thekitchncom,ian burke,this ingenious countertop gadget creates storage out of thin air and matches any kitchen aesthetic,2023-10-16T20:40:00Z
business insider,jen glantz,"i want to retire before 50, so i asked a financial planner for 3 ways to earn more on my savings",2023-10-28T11:29:01Z
business insider,jennifer sor,why now is actually a good time to buy a house,2023-10-21T12:15:01Z
the verge,elizabeth lopatto,"in the end, the ftx trial was about the friends screwed along the way",2023-10-26T12:00:00Z
business insider,polly thompson,joe biden wants more people to start living in empty offices,2023-10-28T11:33:18Z
business insider,george glover,china suffers its first foreign investment deficit as us tensions and anti-spying laws spark a western exodus,2023-11-06T10:07:34Z
ritholtzcom,barry ritholtz,10 tuesday am reads,2023-10-31T10:30:05Z
business insider,filip de mott,beijing will offer fresh stimulus through a rare budget adjustment and increased sovereign debt,2023-10-24T15:54:56Z
business insider,madeline berg,jeff bezos' net worth: how the ex-amazon ceo went from startup founder to one of the richest people in the world,2023-11-01T09:16:02Z
business insider,"katie balevic,jacob shamsian,lloyd lee",a jury found sam bankman-fried guilty in his manhattan criminal trial,2023-11-03T00:02:12Z
business insider,"aaron mok,katie balevic,jacob shamsian",sbf's mom fought back tears and his dad slumped down when the jury said their son was guilty on all 7 counts,2023-11-03T17:56:18Z
theregistercom,laura dobberstein,google shelves plan to build four san francisco googleburbs,2023-11-03T08:29:09Z
business insider,cork gaines,"home buyers are finally seeing a light at the end of the tunnel, but it is going to be painful for homeowners and sellers",2023-10-10T15:19:30Z
business insider,mia jankowicz,gigi hadid condemns 'terrorizing of innocent people' in instagram post following hamas attacks on israel,2023-10-11T11:56:16Z
business insider,phil rosen,china is boosting efforts spread the yuan as it sells a record $75 billion in offshore bonds this year,2023-10-11T17:36:44Z
business insider,phil rosen,china's economy is on shaky ground - but its movie industry is hitting historic box office records,2023-10-16T13:20:48Z
business insider,george glover,elite investor john paulson claims in a new lawsuit that his ex-business partner duped him out of millions to fund louis vuitton shopping sprees and las vegas parties,2023-10-17T11:15:36Z
business insider,hasan chowdhury,"office vacancies have soared to a 20-year high, showing just how tough it is to get workers to return",2023-10-10T11:56:13Z
business insider,jennifer sor,home foreclosures are at their highest level since the start of the pandemic as the 'financial aftermath' take a toll on buyers,2023-10-13T13:48:49Z
business insider,filip de mott,"'bond king' jeffrey gundlach says buy long-dated treasurys, with prices set to rebound going into a recession",2023-10-18T18:14:51Z
vice news,"roshan abraham, jordan pearson",realtor influencers are freaking out after $18 billion conspiracy lawsuit,2023-11-06T18:37:39Z
small business trends,samantha lile,how to hire a property manager,2023-10-18T13:00:57Z
the washington post,rachel kurzius,how to sell a haunted house,2023-10-23T12:42:01Z
theonioncom,the onion,donald trump jr takes witness stand in new york fraud trial against father,2023-11-02T19:09:00Z
tmz,NA,jeff bezos buys florida neighbor's mansion for $79 million,2023-10-13T16:07:48Z
business insider,kelsey neubauer,stay or go: why americans are drawn to — or sick of — living in florida,2023-11-03T16:19:17Z
gizmodocom,dua rashid,roccat vulcan ii review: a flashy upgrade,2023-11-02T21:00:00Z
business insider,lakshmi varanasi,jeff bezos is moving to miami meet some of his neighbors in the exclusive ‘billionaire bunker neighborhood,2023-11-03T21:37:24Z
